=== START OF INFORMATION SECTION ===
Model Family:     Intel 545s Series SSDs
Device Model:     INTEL SSDSC2KW512G8
Serial Number:    BTLA7513037S512DGN
LU WWN Device Id: 5 5cd2e4 14eea7536
Firmware Version: LHF002C
User Capacity:    512,110,190,592 bytes [512 GB]
Sector Size:      512 bytes logical/physical
Rotation Rate:    Solid State Device
Form Factor:      2.5 inches
TRIM Command:     Available, deterministic, zeroed
Device is:        In smartctl database [for details use: -P show]
ATA Version is:   ACS-3 (minor revision not indicated)
SATA Version is:  SATA 3.2, 6.0 Gb/s (current: 6.0 Gb/s)
Local Time is:    Thu Aug 24 00:33:08 2023 CST
SMART support is: Available - device has SMART capability.
SMART support is: Enabled

=== START OF READ SMART DATA SECTION ===
SMART overall-health self-assessment test result: PASSED

General SMART Values:
Offline data collection status:  (0x02)	Offline data collection activity
					was completed without error.
					Auto Offline Data Collection: Disabled.
Self-test execution status:      (   0)	The previous self-test routine completed
					without error or no self-test has ever
					been run.
Total time to complete Offline
data collection: 		(    0) seconds.
Offline data collection
capabilities: 			 (0x53) SMART execute Offline immediate.
					Auto Offline data collection on/off support.
					Suspend Offline collection upon new
					command.
					No Offline surface scan supported.
					Self-test supported.
					No Conveyance Self-test supported.
					Selective Self-test supported.
SMART capabilities:            (0x0003)	Saves SMART data before entering
					power-saving mode.
					Supports SMART auto save timer.
Error logging capability:        (0x01)	Error logging supported.
					General Purpose Logging supported.
Short self-test routine
recommended polling time: 	 (   2) minutes.
Extended self-test routine
recommended polling time: 	 (  30) minutes.
SCT capabilities: 	       (0x003d)	SCT Status supported.
					SCT Error Recovery Control supported.
					SCT Feature Control supported.
					SCT Data Table supported.

SMART Attributes Data Structure revision number: 1
Vendor Specific SMART Attributes with Thresholds:
ID# ATTRIBUTE_NAME          FLAG     VALUE WORST THRESH TYPE      UPDATED  WHEN_FAILED RAW_VALUE
  5 Reallocated_Sector_Ct   0x0032   100   100   000    Old_age   Always       -       0
  9 Power_On_Hours          0x0032   100   100   000    Old_age   Always       -       24193
 12 Power_Cycle_Count       0x0032   100   100   000    Old_age   Always       -       160
170 Unknown_Attribute       0x0033   100   100   010    Pre-fail  Always       -       0
171 Program_Fail_Count      0x0032   100   100   000    Old_age   Always       -       0
172 Erase_Fail_Count        0x0032   100   100   000    Old_age   Always       -       0
173 Unknown_Attribute       0x0033   079   079   005    Pre-fail  Always       -       1413069406491
174 Unexpect_Power_Loss_Ct  0x0032   100   100   000    Old_age   Always       -       36
183 SATA_Downshift_Count    0x0032   100   100   000    Old_age   Always       -       0
184 End-to-End_Error        0x0033   100   100   090    Pre-fail  Always       -       0
187 Reported_Uncorrect      0x0032   100   100   000    Old_age   Always       -       0
190 Temperature_Case        0x0032   028   045   000    Old_age   Always       -       28 (Min/Max 13/45)
192 Unsafe_Shutdown_Count   0x0032   100   100   000    Old_age   Always       -       36
199 CRC_Error_Count         0x0032   100   100   000    Old_age   Always       -       0
225 Host_Writes_32MiB       0x0032   100   100   000    Old_age   Always       -       1787849
226 Workld_Media_Wear_Indic 0x0032   100   100   000    Old_age   Always       -       0
227 Workld_Host_Reads_Perc  0x0032   100   100   000    Old_age   Always       -       0
228 Workload_Minutes        0x0032   100   100   000    Old_age   Always       -       0
232 Available_Reservd_Space 0x0033   100   100   010    Pre-fail  Always       -       0
233 Media_Wearout_Indicator 0x0032   079   079   000    Old_age   Always       -       0
236 Unknown_Attribute       0x0032   100   100   000    Old_age   Always       -       0
241 Host_Writes_32MiB       0x0032   100   100   000    Old_age   Always       -       1787849
242 Host_Reads_32MiB        0x0032   100   100   000    Old_age   Always       -       47693
249 NAND_Writes_1GiB        0x0032   100   100   000    Old_age   Always       -       168542
252 Unknown_Attribute       0x0032   100   100   000    Old_age   Always       -       329

SMART Error Log Version: 1
No Errors Logged

SMART Self-test log structure revision number 1
Num  Test_Description    Status                  Remaining  LifeTime(hours)  LBA_of_first_error
# 1  Extended offline    Completed without error       00%     24193         -
# 2  Extended captive    Interrupted (host reset)      90%     24191         -
# 3  Extended captive    Interrupted (host reset)      90%     24191         -

SMART Selective self-test log data structure revision number 1
 SPAN  MIN_LBA  MAX_LBA  CURRENT_TEST_STATUS
    1        0        0  Not_testing
    2        0        0  Not_testing
    3        0        0  Not_testing
    4        0        0  Not_testing
    5        0        0  Not_testing
Selective self-test flags (0x0):
  After scanning selected spans, do NOT read-scan remainder of disk.
If Selective self-test is pending on power-up, resume after 0 minute delay.
