=== START OF INFORMATION SECTION ===
Model Family:     Sandisk SATA Cloudspeed Max and GEN2 ESS SSDs
Device Model:     SDLF1CRR-019T-1HA1
Serial Number:    A007C9D9
LU WWN Device Id: 5 001173 100a88424
Firmware Version: ZR11RPA1
User Capacity:    1,920,383,410,176 bytes [1.92 TB]
Sector Sizes:     512 bytes logical, 4096 bytes physical
Rotation Rate:    Solid State Device
TRIM Command:     Available, deterministic, zeroed
Device is:        In smartctl database [for details use: -P show]
ATA Version is:   ATA8-ACS T13/1699-D revision 4c
SATA Version is:  SATA 3.1, 6.0 Gb/s (current: 6.0 Gb/s)
Local Time is:    Wed Aug 23 15:13:40 2023 CST
SMART support is: Available - device has SMART capability.
SMART support is: Enabled

=== START OF READ SMART DATA SECTION ===
SMART overall-health self-assessment test result: PASSED

General SMART Values:
Offline data collection status:  (0x00) Offline data collection activity
                                        was never started.
                                        Auto Offline Data Collection: Disabled.
Self-test execution status:      (   0) The previous self-test routine completed
                                        without error or no self-test has ever
                                        been run.
Total time to complete Offline
data collection:                (20160) seconds.
Offline data collection
capabilities:                    (0x5d) SMART execute Offline immediate.
                                        No Auto Offline data collection support.
                                        Abort Offline collection upon new
                                        command.
                                        Offline surface scan supported.
                                        Self-test supported.
                                        No Conveyance Self-test supported.
                                        Selective Self-test supported.
SMART capabilities:            (0x0003) Saves SMART data before entering
                                        power-saving mode.
                                        Supports SMART auto save timer.
Error logging capability:        (0x01) Error logging supported.
                                        General Purpose Logging supported.
Short self-test routine
recommended polling time:        (   1) minutes.
Extended self-test routine
recommended polling time:        (   1) minutes.
SCT capabilities:              (0x003d) SCT Status supported.
                                        SCT Error Recovery Control supported.
                                        SCT Feature Control supported.
                                        SCT Data Table supported.

SMART Attributes Data Structure revision number: 16
Vendor Specific SMART Attributes with Thresholds:
ID# ATTRIBUTE_NAME          FLAG     VALUE WORST THRESH TYPE      UPDATED  WHEN_FAILED RAW_VALUE
  5 Reallocated_Sector_Ct   0x0033   100   100   010    Pre-fail  Always       -       0
  9 Power_On_Hours          0x0032   046   046   000    Old_age   Always       -       47763 (2 27 0)
 13 Lifetime_UECC_Ct        0x0012   100   100   001    Old_age   Always       -       0
 32 Lifetime_Write_AmpFctr  0x0002   100   100   000    Old_age   Always       -       0
 33 Write_AmpFctr           0x0002   100   100   000    Old_age   Always       -       100
170 Reserve_Erase_BlkCt     0x0032   100   100   000    Old_age   Always       -       18218
171 Program_Fail_Ct         0x0032   100   100   000    Old_age   Always       -       0
172 Erase_Fail_Ct           0x0032   100   100   000    Old_age   Always       -       0
175 Lifetime_Die_Failure_Ct 0x0032   100   100   000    Old_age   Always       -       0
178 SSD_LifeLeft(0.01%)     0x0012   100   100   000    Old_age   Always       -       9126
183 LT_Link_Rate_DwnGrd_Ct  0x0032   100   100   000    Old_age   Always       -       0
191 Clean_Shutdown_Ct       0x0032   100   100   000    Old_age   Always       -       46
192 Unclean_Shutdown_Ct     0x0032   100   100   000    Old_age   Always       -       0
194 Temperature_Celsius     0x0022   068   059   030    Old_age   Always       -       32 (Min/Max 19/41)
196 Lifetime_Retried_Blk_Ct 0x001b   100   100   010    Pre-fail  Always       -       0
199 UDMA_CRC_Error_Count    0x003e   100   100   000    Old_age   Always       -       0
211 Read_Disturb_ReallocEvt 0x0032   100   100   000    Old_age   Always       -       0
233 Lifetime_Nand_Writes    0x0032   100   100   000    Old_age   Always       -       1347968
235 Capacitor_Health        0x0032   100   100   000    Old_age   Always       -       0
241 Total_LBAs_Written      0x0032   100   100   000    Old_age   Always       -       806144
242 Total_LBAs_Read         0x0032   100   100   000    Old_age   Always       -       923840
244 Therm_Throt_Activation  0x0032   100   100   000    Old_age   Always       -       0
245 Drive_Life_Remaining%   0x0012   092   092   002    Old_age   Always       -       92
253 SPI_Test_Remaining      0x0012   100   100   001    Old_age   Always       -       0

SMART Error Log Version: 1
No Errors Logged

SMART Self-test log structure revision number 1
Num  Test_Description    Status                  Remaining  LifeTime(hours)  LBA_of_first_error
# 1  Extended captive    Completed without error       00%     47763         -

SMART Selective self-test log data structure revision number 1
 SPAN  MIN_LBA  MAX_LBA  CURRENT_TEST_STATUS
    1        0        0  Not_testing
    2        0        0  Not_testing
    3        0        0  Not_testing
    4        0        0  Not_testing
    5        0        0  Not_testing
Selective self-test flags (0x0):
  After scanning selected spans, do NOT read-scan remainder of disk.
If Selective self-test is pending on power-up, resume after 0 minute delay.
