    cap 05[90] = MSI supports 1 message
    cap 05[90] = MSI supports 1 message
    cap 05[ac] = MSI supports 1 message
    cap 05[80] = MSI supports 1 message
    cap 05[80] = MSI supports 8 messages, 64 bit enabled with 1 message
    cap 05[8c] = MSI supports 1 message, 64 bit
    cap 05[80] = MSI supports 1 message enabled with 1 message
    cap 05[80] = MSI supports 1 message
    cap 05[80] = MSI supports 1 message
    cap 05[80] = MSI supports 1 message
    cap 05[80] = MSI supports 1 message
    cap 05[80] = MSI supports 1 message
    cap 05[80] = MSI supports 1 message
    cap 05[80] = MSI supports 1 message
    cap 05[60] = MSI supports 1 message, 64 bit enabled with 1 message
    cap 05[a0] = MSI supports 1 message, 64 bit
    cap 05[a0] = MSI supports 1 message, 64 bit
    cap 05[a0] = MSI supports 1 message, 64 bit
    cap 11[d0] = MSI-X supports 9 messages, enabled
    cap 05[e0] = MSI supports 8 messages, 64 bit
    cap 05[50] = MSI supports 1 message, 64 bit, vector masks
    cap 11[70] = MSI-X supports 5 messages, enabled
    cap 05[50] = MSI supports 1 message, 64 bit, vector masks
    cap 11[70] = MSI-X supports 5 messages, enabled
    cap 05[50] = MSI supports 1 message, 64 bit, vector masks
    cap 11[70] = MSI-X supports 5 messages, enabled
    cap 05[50] = MSI supports 1 message, 64 bit, vector masks
    cap 11[70] = MSI-X supports 5 messages, enabled
    cap 11[d0] = MSI-X supports 9 messages, enabled
    cap 05[e0] = MSI supports 8 messages, 64 bit
