NVME Identify Controller:
vid       : 0x144d
ssvid     : 0x144d
sn        : S676NF0R908202      
mn        : SAMSUNG MZVL21T0HCLR-00B00              
fr        : GXA7401Q
rab       : 2
ieee      : 002538
cmic      : 0
mdts      : 7
cntlid    : 0x6
ver       : 0x10300
rtd3r     : 0x30d40
rtd3e     : 0x989680
oaes      : 0x200
ctratt    : 0x10
rrls      : 0
crdt1     : 0
crdt2     : 0
crdt3     : 0
oacs      : 0x17
acl       : 7
aerl      : 3
frmw      : 0x16
lpa       : 0xe
elpe      : 63
npss      : 4
avscc     : 0x1
apsta     : 0x1
wctemp    : 354
cctemp    : 358
mtfa      : 0
hmpre     : 0
hmmin     : 0
tnvmcap   : 1024209543168
unvmcap   : 0
rpmbs     : 0
edstt     : 35
dsto      : 0
fwug      : 0
kas       : 0
hctma     : 0x1
mntmt     : 318
mxtmt     : 356
sanicap   : 0x2
hmminds   : 0
hmmaxd    : 0
nsetidmax : 0
anatt     : 0
anacap    : 0
anagrpmax : 0
nanagrpid : 0
sqes      : 0x66
cqes      : 0x44
maxcmd    : 256
nn        : 1
oncs      : 0x57
fuses     : 0
fna       : 0
vwc       : 0x7
awun      : 1023
awupf     : 0
nvscc     : 1
nwpc      : 0
acwu      : 0
sgls      : 0
mnan      : 0
subnqn    : nqn.1994-11.com.samsung:nvme:PM9A1:M.2:S676NF0R908202      
ioccsz    : 0
iorcsz    : 0
icdoff    : 0
ctrattr   : 0
msdbd     : 0
ps    0 : mp:8.37W operational enlat:0 exlat:0 rrt:0 rrl:0
          rwt:0 rwl:0 idle_power:- active_power:-
ps    1 : mp:8.37W operational enlat:0 exlat:200 rrt:1 rrl:1
          rwt:1 rwl:1 idle_power:- active_power:-
ps    2 : mp:8.37W operational enlat:0 exlat:200 rrt:2 rrl:2
          rwt:2 rwl:2 idle_power:- active_power:-
ps    3 : mp:0.0500W non-operational enlat:2000 exlat:1200 rrt:3 rrl:3
          rwt:3 rwl:3 idle_power:- active_power:-
ps    4 : mp:0.0050W non-operational enlat:500 exlat:9500 rrt:4 rrl:4
          rwt:4 rwl:4 idle_power:- active_power:-
